{
  "spec": "cupel-spec/1",
  "kind": "input",
  "runtime": {
    "name": "node",
    "version": "22.23.3"
  },
  "sources": {
    "src/a.mjs": {
      "coverable": "1-8",
      "hash": "h2"
    }
  },
  "tests": [
    {
      "id": "d",
      "file": "tests/d.test.mjs",
      "name": "d",
      "status": "passed"
    }
  ],
  "coverage": {
    "granularity": "test",
    "byTest": {
      "d": {
        "src/a.mjs": "1-4"
      }
    }
  }
}
