{
  "spec": "cupel-spec/1",
  "kind": "input",
  "runtime": {
    "name": "node",
    "version": "22.23.3"
  },
  "sources": {
    "src/a.mjs": {
      "coverable": "1-3"
    }
  },
  "tests": [
    {
      "id": "t",
      "file": "tests/t.test.mjs",
      "name": "t",
      "status": "passed"
    }
  ],
  "coverage": {
    "granularity": "test",
    "byTest": {
      "t": {
        "src/a.mjs": "1-2"
      }
    }
  }
}
