{
  "spec": "cupel-spec/1",
  "kind": "input",
  "runtime": {
    "name": "node",
    "version": "22.23.3"
  },
  "sources": {
    "src/auth-a.mjs": {
      "coverable": "1-10",
      "hash": "a1"
    },
    "src/auth-b.mjs": {
      "coverable": "1-30",
      "hash": "b2"
    }
  },
  "tests": [
    {
      "id": "k",
      "file": "tests/k.test.mjs",
      "name": "k",
      "status": "passed"
    }
  ],
  "coverage": {
    "granularity": "test",
    "byTest": {
      "k": {
        "src/auth-a.mjs": "1-10"
      }
    }
  }
}
