{
  "spec": "cupel-spec/1",
  "kind": "input",
  "runtime": {
    "name": "node",
    "version": "22.23.3"
  },
  "sources": {
    "src/a.mjs": {
      "coverable": "1-10"
    }
  },
  "tests": [
    {
      "id": "k",
      "file": "tests/k.test.mjs",
      "name": "k",
      "status": "passed"
    },
    {
      "id": "r1",
      "file": "tests/r1.test.mjs",
      "name": "r1",
      "status": "passed"
    },
    {
      "id": "r2",
      "file": "tests/r2.test.mjs",
      "name": "r2",
      "status": "passed"
    }
  ],
  "coverage": {
    "granularity": "test",
    "byTest": {
      "k": {
        "src/a.mjs": "1-6"
      },
      "r1": {
        "src/a.mjs": "2-4"
      },
      "r2": {
        "src/a.mjs": "3"
      }
    },
    "rechecked": [
      "r1"
    ]
  },
  "mutation": {
    "mutants": [
      {
        "id": "m1",
        "source": "src/a.mjs",
        "line": 3,
        "operator": "flip",
        "status": "killed",
        "killedBy": [
          "k"
        ]
      }
    ],
    "targeted": [
      "r2"
    ]
  }
}
