{
  "spec": "cupel-spec/1",
  "kind": "input",
  "runtime": {
    "name": "node",
    "version": "22.23.3"
  },
  "sources": {
    "src/billing/ledger.mjs": {
      "coverable": "1-10"
    },
    "src/util.mjs": {
      "coverable": "1-10"
    }
  },
  "tests": [
    {
      "id": "p",
      "file": "tests/p.test.mjs",
      "name": "p",
      "status": "passed"
    },
    {
      "id": "q",
      "file": "tests/q.test.mjs",
      "name": "q",
      "status": "passed"
    }
  ],
  "coverage": {
    "granularity": "test",
    "byTest": {
      "p": {
        "src/billing/ledger.mjs": "1-5"
      },
      "q": {
        "src/billing/ledger.mjs": "1-3",
        "src/util.mjs": "1-4"
      }
    }
  }
}
