{
  "spec": "cupel-spec/1",
  "kind": "input",
  "runtime": {
    "name": "node",
    "version": "22.23.3"
  },
  "sources": {
    "src/a.mjs": {
      "coverable": "1-10"
    }
  },
  "tests": [
    {
      "id": "f",
      "file": "tests/f.test.mjs",
      "name": "f",
      "status": "failed"
    },
    {
      "id": "r",
      "file": "tests/r.test.mjs",
      "name": "r",
      "status": "passed"
    }
  ],
  "coverage": {
    "granularity": "test",
    "byTest": {
      "f": {
        "src/a.mjs": "1-6"
      },
      "r": {
        "src/a.mjs": "2-4"
      }
    },
    "rechecked": [
      "r"
    ]
  },
  "mutation": {
    "mutants": [],
    "targeted": [
      "r"
    ]
  }
}
