{
  "spec": "cupel-spec/1",
  "kind": "input",
  "runtime": {
    "name": "node",
    "version": "22.23.3"
  },
  "sources": {
    "src/a.mjs": {
      "coverable": "1-10",
      "hash": "hb"
    },
    "src/auth.mjs": {
      "coverable": "1-10",
      "hash": "ha"
    }
  },
  "tests": [
    {
      "id": "d",
      "file": "tests/d.test.mjs",
      "name": "d",
      "status": "passed"
    },
    {
      "id": "k",
      "file": "tests/k.test.mjs",
      "name": "k",
      "status": "passed",
      "tags": [
        "critical"
      ]
    }
  ],
  "coverage": {
    "granularity": "test",
    "byTest": {
      "d": {
        "src/a.mjs": "1-2"
      },
      "k": {
        "src/auth.mjs": "1-4"
      }
    }
  },
  "mutation": {
    "mutants": [
      {
        "id": "m1",
        "source": "src/auth.mjs",
        "line": 2,
        "operator": "flip",
        "status": "killed",
        "killedBy": [
          "k"
        ]
      },
      {
        "id": "m2",
        "source": "src/a.mjs",
        "line": 1,
        "operator": "flip",
        "status": "killed",
        "killedBy": [
          "d"
        ]
      }
    ]
  }
}
